{"$id":"/schemas/ExecutionPlan.schema.json","$schema":"https://json-schema.org/draft/2020-12/schema","additionalProperties":false,"properties":{"canonicalization":{"additionalProperties":false,"properties":{"sha256":{"pattern":"^[0-9a-f]{64}$","type":"string"},"version":{"pattern":"^\\d+\\.\\d+\\.\\d+$","type":"string"}},"required":["version","sha256"],"type":"object"},"planVersion":{"pattern":"^\\d+\\.\\d+\\.\\d+$","type":"string"},"schemaVersion":{"pattern":"^\\d+\\.\\d+\\.\\d+$","type":"string"},"steps":{"items":{"additionalProperties":false,"properties":{"key":{"type":"string"},"operationId":{"type":"string"}},"required":["key","operationId"],"type":"object"},"type":"array"},"workflowDigest":{"pattern":"^[0-9a-f]{64}$","type":"string"}},"required":["schemaVersion","planVersion","workflowDigest","steps","canonicalization"],"title":"ExecutionPlan","type":"object"}